langcode,title,field_a2zpublisher,field_a2zsubject,field_a2zurl,field_author,field_isbn,field_vol,field_year
,Basics ofSurface Technology,New Age International,"Engineering , Chemical & Biochemical , Mechanical",http://elib4u.ipublishcentral.com/product/basics-ofsurface-technology ,"M Kamaraj  , V M Radhakrishnan",9788122444384,,2016
,Basis Theory Primer,Springer Nature,Mathematics and Statistics,https://doi.org/10.1007/978-0-8176-4687-5,Christopher Heil,9780817646875,,2011
,BATS Codes,Synthesis Collection of Technology (R0),"Communications Engineering, Communication Networks",https://doi.org/10.1007/978-3-031-79278-6,"Shenghao Yang, Raymond W. Yeung",9783031792786,,2017
,Battery Management Algorithm for Electric Vehicles,Springer Nature,Energy,https://doi.org/10.1007/978-981-15-0248-4,Rui Xiong,9789811502484,,2020
,Bauhaus (Lesson Plan),Bloomsbury Design Library,Art & design styles,https://doi.org/10.5040/9781350097964.002?locatt=label:secondary_bloomsburyVisualArts,Clive Edwards,9781350097964,,2017
,Bauhaus Bodies,Bloomsbury Design Library 2019 Collection,Bauhaus,https://doi.org/10.5040/9781501344817?locatt=label:secondary_bloomsburyVisualArts,Elizabeth Otto and Patrick Rössler (eds),9781501344817,,2019
,Bauhaus: An Annotated Bibliography (Bibliographic Guides),Bloomsbury Design Library,Art & design styles,https://doi.org/10.5040/9781350097957.002?locatt=label:secondary_bloomsburyVisualArts,Clive Edwards,9781350097957,,2017
,Bayesian Analysis in Natural Language Processing,Synthesis Collection of Technology (R0),"Artificial Intelligence, NLP, Computational Linguistics",https://doi.org/10.1007/978-3-031-02161-9,Shay Cohen,9783031021619,,2016
,Bayesian Analysis in Natural Language Processing,Synthesis Collection of Technology (R0),"Artificial Intelligence, NLP, Computational Linguistics",https://doi.org/10.1007/978-3-031-02170-1,Shay Cohen,9783031021701,2nd ed.,2019
,Bayesian Probability Theory,Cambridge University Press,"Physics and Astronomy,Statistics and Probability, Mathematical Methods,Statistics for Physical Sciences and Engineering",https://doi.org/10.1017/CBO9781139565608,Linden/Dose/Toussaint,9781139565608,,2014
,Bayesian Statistical Inference,SAGE Publications Ltd,Statistical Inference,https://doi.org/10.4135/9781412983501,Gudmund R. Iversen,9781412983501,,1984
,Bayesian Time Series Models,Cambridge University Press,"Statistics and Probability,Computer Science, Pattern Recognition and Machine Learning,Computational Statistics, Machine Learning and Information Science",https://doi.org/10.1017/CBO9780511984679,Barber/Cemgil/Chiappa,9780511984679,,2011
,Bearing Dynamic Coefficients in Rotordynamics: Computation Methods and Practical Applications,Wiley,Physical Sciences & Engineering,https://onlinelibrary.wiley.com/doi/book/10.1002/9781119759287,Lukas Brenkacz,9781119759287,,2021
,Beautiful Thing,Bloomsbury Design Library,Industrial design,https://doi.org/10.5040/9781350036093?locatt=label:secondary_bloomsburyVisualArts,Robert Clay,9781350036093,,2009
,Because Technology Discriminates,Synthesis Collection of Technology (R0),"Engineering Design, Ethics",https://doi.org/10.1007/978-3-031-27868-6,Logan D. A. Williams,9783031278686,,2023
,Becoming Human by Design,Bloomsbury Design Library,"Design ,Human factors",https://doi.org/10.5040/9781474294041?locatt=label:secondary_bloomsburyVisualArts,Tony Fry,9781474294041,,2012
,Beginning Statistics,SAGE Publications Ltd,"Statistics,  Methodology",https://doi.org/10.4135/9781446249437,Julie Jefferies; Ian Diamond,9781446249437,,2001
,Behavior Analysis and Modeling of Traffic Participants,Synthesis Collection of Technology (R0),"Automotive Engineering, Transportation Technology",https://doi.org/10.1007/978-3-031-01509-0,"Xiaolin Song, Haotian Cao",9783031015090,,2022
,Behavior and Evolutionary Dynamics in Crowd Networks,Springer,Computer Science,http://link.springer.com/openurl?genre=book&isbn=978-981-15-7160-2,"Yan Chen, H. Vicky Zhao",9789811571602,,2020
,Being a Researcher,Springer,Computer Science,http://link.springer.com/openurl?genre=book&isbn=978-3-030-45157-8,Carlo Ghezzi,9783030451578,,2020
,Being Ethnographic,SAGE Publications Ltd,Ethnography,https://doi.org/10.4135/9781529716689,Morgan,9781529716689,,2017
,Benchmark Models of Control System Design for Remotely Operated Vehicles,Springer,Computer Science,http://link.springer.com/openurl?genre=book&isbn=978-981-15-6511-3,"Cheng Siong Chin, Michael Wai Shing Lau",9789811565113,,2020
,"Benchmarking, Measuring, and Optimizing",Springer,Computer Science,http://link.springer.com/openurl?genre=book&isbn=978-3-030-49556-5,"Wanling Gao, Jianfeng Zhan, Geoffrey Fox, Xiaoyi Lu, Dan Stanzione",9783030495565,,2020
,Bent Functions and Permutation Methods,Synthesis Collection of Technology (R0),"Circuits and systems, Cryptology",https://doi.org/10.1007/978-3-031-50650-5,"Radomir S. Stanković, Milena Stanković, Claudio Moraga, Jaakko Astola",9783031506505,,2024
,Bernstein Functions,De Gruyter,"Probability and Statistics , Probability and Statistics",http://www.degruyter.com/isbn/9783110215311,"Schilling, René L. / Song, Renming / Vondracek, Zoran",9783110215311,,2010
,Besov Spaces and Applications to Difference Methods for Initial Value Problems,Springer,Mathematics,http://dx.doi.org/10.1007/BFb0068125,"Philip Brenner, Vidar Thomée, Lars B. Wahlbin",9783540374008,434,1975
,Bessel Polynomials,Springer,Mathematics,http://dx.doi.org/10.1007/BFb0063135,Emil Grosswald,9783540355489,698,1978
,Best Practices in Data Cleaning,SAGE Publications Ltd,Data Cleaning,https://doi.org/10.4135/9781452269948,Jason W. Osborne,9781452269948,,2013
,Best Practices in Logistic Regression,SAGE Publications Ltd,Logistic Regression,https://doi.org/10.4135/9781483399041,Jason W. Osborne,9781483399041,,2015
,Best Practices in Quantitative Methods,SAGE Publications Ltd,"Research, Methodology",https://doi.org/10.4135/9781412995627,Jason W. Osborne,9781412995627,,2008
,Beta Decay of Hyperons,Springer,Physics,http://dx.doi.org/10.1007/3-540-15184-2,"A. García, P. Kielanowski",9783540392637,222,1985
,Beyond Binary Memory Circuits,Synthesis Collection of Technology (R0),Circuits and Systems,https://doi.org/10.1007/978-3-031-16195-7,"Zarin Tasnim Sandhie, Farid Uddin Ahmed, Masud H. Chowdhury",9783031161957,,2022
,Beyond Equilibrium Thermodynamics,Wiley,"Chemistry, Chemical Engineering",https://onlinelibrary.wiley.com/doi/book/10.1002/0471727903,Ottinger,9780471727903,,2005
,Beyond Interactions,Springer,Computer Science,http://link.springer.com/openurl?genre=book&isbn=978-3-030-46540-7,"José Abdelnour Nocera, Antigoni Parmaxi, Marco Winckler, Fernando Loizides, Carmelo Ardito, Ganesh Bhutkar, Peter Dannenmann",9783030465407,,2020
,Beyond Planar Graphs,Springer,Computer Science,http://link.springer.com/openurl?genre=book&isbn=978-981-15-6533-5,"Seok-Hee Hong, Takeshi Tokuyama",9789811565335,,2020
,Beyond the Horizon of Computability,Springer,Computer Science,http://link.springer.com/openurl?genre=book&isbn=978-3-030-51466-2,"Marcella Anselmo, Gianluca Della Vedova, Florin Manea, Arno Pauly",9783030514662,,2020
,Bhagva Banaam Tiranga,SAGE,Politics,https://evidya.sagepub.in/library/bhagava-banaam-tiranga?bookId=4407&siteName=evidya,Ziya Us Salam,,,2016
,Bharat 2050,SAGE,"Development Studies, Development Economics",https://evidya.sagepub.in/library/bharat-2050?bookId=3486&siteName=evidya,Ramgopal Agarwala,,,2016
,"Bharat ka Samvidhan, Vrittik Acharniti aur Manav Adhikar",SAGE,Vocational & Professional Studies,"https://evidya.sagepub.in/library/bharat-ka-samvidhan,-vrittik-acharniti-aur-manav-adhikar?bookId=3615&siteName=evidya",Praveenkumar Mellalli,,,2016
,Bharat ki Videsh Neeti,SAGE,"International Relations, South Asia Studies",https://evidya.sagepub.in/library/bharat-ki-videsh-neeti?bookId=2981&siteName=evidya,Rajiv Sikri,,,2016
,Bharat Mein Dalit,SAGE,"Economics & Development Studies, Class & Inequality",https://evidya.sagepub.in/library/bharat-mein-dalit?bookId=3438&siteName=evidya,Sukhadeo Thorat,,,2016
,Bharat Mein Gharelu Hinsa,SAGE,"Gender & Sexuality Studies, Sociology of Gender",https://evidya.sagepub.in/library/bharat-mein-gharelu-hinsa?bookId=3297&siteName=evidya,Rinki Bhattacharya,,,2016
,Bharat Mein Jaati Evam Prajaati,SAGE,"Sociology, Political Science (General)",https://evidya.sagepub.in/library/bharat-mein-jaati-evam-prajaati?bookId=3311&siteName=evidya,G. S. Ghurye,,,2016
,Bharat mein Jansankhya Sambandhi Mudde,SAGE,"Economics & Development Studies, Urban Studies",https://evidya.sagepub.in/library/bharat-mein-jansankhya-sambandhi-mudde?bookId=4408&siteName=evidya,Krishnamurthy Srinivasan,,,2016
,Bharat mein Matdan Vyavhar ka Mapan,SAGE,"Political Psychology, Sociological Research Methods",https://evidya.sagepub.in/library/bharat-mein-matdan-vyavhar-ka-mapan?bookId=3495&siteName=evidya,Sanjay Kumar,,,2016
,Bharat mein Rajneetik Andolano ka Samkaleen Itihaas,SAGE,"Political Science (General), Sociology",https://evidya.sagepub.in/library/bharat-mein-rajneetik-andolano-ka-samkaleen-itihaas?bookId=3464&siteName=evidya,Ajay Gudavarthy,,,2016
,Bharat Mein Sukshma Vitt,SAGE,"Financial Economics, Development Economics",https://evidya.sagepub.in/library/bharat-mein-sukshma-vitt?bookId=3298&siteName=evidya,K G. Karmakar,,,2016
,Bharateey Yuva aur Chunavi Rajneeti,SAGE,"Political Science (General), Asian Politics",https://evidya.sagepub.in/library/bharateey-yuva-aur-chunavi-rajneeti?bookId=3536&siteName=evidya,Sanjay Kumar,,,2016
,Bhartiya Arthvyawastha ka Sankaraman Kaal,SAGE,"Economics & Development Studies, ",https://evidya.sagepub.in/library/bhaarateey-arthavyavastha-ka-sankraman-kaal?bookId=4409&siteName=evidya,S  Janakrajan,,,2016
,Bhartiya Itihaas Ka Adhyayan Ek Parichay,SAGE,"History, Sociology",https://evidya.sagepub.in/library/bhartiya-itihaas-ka-adhyayan-ek-parichay?bookId=4420&siteName=evidya,Late Damodar Dharmanand Kosambi,,,2016
,Bhartiya Media Vyavsay,SAGE,"Business & Management, Communication & Media Studies",https://evidya.sagepub.in/library/bhartiya-media-vyavsay?bookId=2979&siteName=evidya,Vanita Kohli-Khandekar,,,2017
,Bhartiya Prashasan ,SAGE,"Political Science & International Relations, Public Policy & Public Administration",https://evidya.sagepub.in/library/bhartiya-prashasan?bookId=3629&siteName=evidya,Bidyut Chakrabarty,,,2017
,Bhartiya Rashtravad ki Samajik Prishthbhoomi,SAGE,"Sociology, Political Science (General)",https://evidya.sagepub.in/library/bhartiya-rashtravad-ki-samajik-prishthbhoomi?bookId=3460&siteName=evidya,A. R. Desai,,,2017
,Bhartiya Sena me Netritv,SAGE,Asian History,https://evidya.sagepub.in/library/bhartiya-sena-me-netritv?bookId=3398&siteName=evidya,V K Singh,,,2017
,Bhartiya Uccha Shiksha ke Paanch Dashak,SAGE,"Planning, Urban Planning",https://evidya.sagepub.in/library/bhartiya-uccha-shiksha-ke-paanch-dashak?bookId=3312&siteName=evidya,Pawan Agarwal,,,2017
,Bias and Social Aspects in Search and Recommendation,Springer,Computer Science,http://link.springer.com/openurl?genre=book&isbn=978-3-030-52485-2,"Ludovico Boratto, Stefano Faralli, Mirko Marras, Giovanni Stilo",9783030524852,,2020
,Bifurcation and Nonlinear Eigenvalue Problems,Springer,Mathematics,http://dx.doi.org/10.1007/BFb0090424,"C. Bardos, J. M. Lasry, M. Schatzman",9783540386377,782,1980
,Bifurcation Dynamics of a Damped Parametric Pendulum,Synthesis Collection of Technology (R0),"Engineering, Nanotechnology",https://doi.org/10.1007/978-3-031-79645-6,"Yu Guo, Albert C.J. Luo",9783031796456,,2020
,Bifurcation of Extremals in Optimal Control,Springer,Mathematics,http://dx.doi.org/10.1007/BFb0077060,Jacob Kogan,9783540470656,1216,1986
,Bifurcation Theory and Applications,Springer,Mathematics,http://dx.doi.org/10.1007/BFb0098592,Luigi Salvadori,9783540388128,1057,1984
,Bifurcations of Planar Vector Fields: Nilpotent Singularities and Abelian Integrals,Springer,Mathematics,http://dx.doi.org/10.1007/BFb0098353,"Freddy Dumortier, Robert Roussarie, Jorge Sotomayor, Henryk Żaładek",9783540384335,1480,1991
,"Bifurcations of Planar Vector Fields: Proceedings of a Meeting held in Luminy, France",Springer,Mathematics,http://dx.doi.org/10.1007/BFb0085387,"Jean-Pierre Françoise, Robert Roussarie",9783540467229,1455,1990
,Big Data,McGraw Hill,Computer Science,https://resolver.vitalsource.com/9789353167967/?brand=mcgrawhillindia.vitalsource.com  ,Maheshwari,,2nd ed.,2019
,Big Data,McGraw Hill,Computer Science,https://resolver.vitalsource.com/9789352604548/?brand=mcgrawhillindia.vitalsource.com  ,Maheshwari,,,2017
,Big Data – BigData 2020,Springer,Computer Science,http://link.springer.com/openurl?genre=book&isbn=978-3-030-59612-5,"Surya Nepal, Wenqi Cao, Aziz Nasridinov, MD Zakirul Alam Bhuiyan, Xuan Guo, Liang-Jie Zhang",9783030596125,,2020
,Big Data 2.0 Processing Systems,Springer,Computer Science,http://link.springer.com/openurl?genre=book&isbn=978-3-030-44187-6,Sherif Sakr,9783030441876,,2020
,Big Data Analytics,Springer,Computer Science,http://link.springer.com/openurl?genre=book&isbn=978-3-030-66665-1,"Ladjel Bellatreche, Vikram Goyal, Hamido Fujita, Anirban Mondal, P. Krishna Reddy",9783030666651,,2020
,Big Data Analytics and Artificial Intelligence Against COVID-19: Innovation Vision and Approach,Springer,Computer Science,http://link.springer.com/openurl?genre=book&isbn=978-3-030-55258-9,"Aboul-Ella Hassanien, Nilanjan Dey, Sally Elghamrawy",9783030552589,,2020
,Big Data Analytics and Knowledge Discovery,Springer,Computer Science,http://link.springer.com/openurl?genre=book&isbn=978-3-030-59065-9,"Min Song, Il-Yeol Song, Gabriele Kotsis, A Min Tjoa, Ismail Khalil",9783030590659,,2020
,Big Data Analytics for Time-Critical Mobility Forecasting,Springer,Computer Science,http://link.springer.com/openurl?genre=book&isbn=978-3-030-45164-6,"George A. Vouros, Gennady Andrienko, Christos Doulkeridis, Nikolaos Pelekis, Alexander Artikis, Anne-Laure Jousselme, Cyril Ray, Jose Manuel Cordero, David Scarlatti",9783030451646,,2020
,Big Data and Analytics,Wiley India,Engineering,https://ebooks.wileyindia.com/product-details/282477,"Seema Acharya, Subhashini Chellappan",9788126588367,2nd ed.,2019
,Big Data and Security,Springer,Computer Science,http://link.springer.com/openurl?genre=book&isbn=978-981-15-7530-3,"Yuan Tian, Tinghuai Ma, Muhammad Khurram Khan",9789811575303,,2020
,Big Data in Emergency Management: Exploitation Techniques for Social and Mobile Data,Springer,Computer Science,http://link.springer.com/openurl?genre=book&isbn=978-3-030-48099-8,Rajendra Akerkar,9783030480998,,2020
,Big Data Integration,Synthesis Collection of Technology (R0),"Data Structures, Information Theory",https://doi.org/10.1007/978-3-031-01853-4,"Xin Luna Dong, Divesh Srivastava",9783031018534,,2015
,Big Data Management and Analytics,Springer,Computer Science,http://link.springer.com/openurl?genre=book&isbn=978-3-030-61627-4,"Ralf-Detlef Kutsche, Esteban Zimányi",9783030616274,,2020
,Big Data Preprocessing,Springer,Computer Science,http://link.springer.com/openurl?genre=book&isbn=978-3-030-39105-8,"Julián Luengo, Diego García-Gil, Sergio Ramírez-Gallego, Salvador García, Francisco Herrera",9783030391058,,2020
,"Big Data, Machine Learning, and Applications",Springer,Computer Science,http://link.springer.com/openurl?genre=book&isbn=978-3-030-62625-9,"Ripon Patgiri, Sivaji Bandyopadhyay, Malaya Dutta Borah, Dalton Meitei Thounaojam",9783030626259,,2020
,Big Picture,Synthesis Collection of Technology (R0),Astronomy and Cosmology,https://doi.org/10.1007/978-3-031-02080-3,John Beaver,9783031020803,,2020
,Bihar ki Chunavi Rajneeti,SAGE,Politics,https://evidya.sagepub.in/library/bihar-ki-chunavi-rajniti?bookId=4410&siteName=evidya,Sanjay Kumar,,,2017
,Billingsley Dimension in Probability Spaces,Springer,Mathematics,http://dx.doi.org/10.1007/BFb0091622,Helmut Cajar,9783540386384,892,1981
,Binary Code Fingerprinting for Cybersecurity,Springer,Computer Science,http://link.springer.com/openurl?genre=book&isbn=978-3-030-34238-8,"Saed Alrabaee, Mourad Debbabi, Paria Shirani, Lingyu Wang, Amr Youssef, Ashkan Rahimian, Lina Nouh, Djedjiga Mouheb, He Huang, Aiman Hanna",9783030342388,,2020
,Bioastronomy The Search for Extraterrestial Life — The Exploration Broadens,Springer,Physics,http://dx.doi.org/10.1007/3-540-54752-5,"Jean Heidmann, Michael J. Klein",9783540464471,390,1991
,Biochemical Engineering,CBS Publishers,Biochemical Engineering and Biotechnology,https://eduport-global.com/product/biochemical-engineering50090868,Bailey,9789388327251,,2020
,Biochemistry,McGraw Hill,Science,https://resolver.vitalsource.com/9780071322188/?brand=mcgrawhillindia.vitalsource.com  ,Rastogi,,3rd ed.,2011
,Bioinformatics,Synthesis Collection of Technology (R0),"Genetics, Genomics",https://doi.org/10.1007/978-3-031-20017-5,"Khalid Sayood, Hasan H. Otu",9783031200175,,2022
