langcode,title,field_a2zpublisher,field_a2zsubject,field_a2zurl,field_author,field_isbn,field_vol,field_year
,Collaborative Research in Organizations,SAGE Publications Ltd,"Management, Research",https://doi.org/10.4135/9781412983679,Niclas Adler; Alexander Styhre; A. B. (Rami) Shani,9781412983679,,2004
,Collaborative Web Search,Synthesis Collection of Technology (R0),"Computing and Processing, Communication, Networking and Broadcast Technologies",https://doi.org/10.1007/978-3-031-02270-8,"Meredith Ringel Morris, Jaime Teevan",9783031022708,,2010
,Collapsing Gracefully: Making a Built Environment that is Fit for the Future,Springer Nature,Social Sciences,https://doi.org/10.1007/978-3-030-77783-8,"Emilio Garcia, Brenda Vale, Robert Vale",9783030777838,,2021
,Collecting Qualitative Data,SAGE Publications Ltd,Qualitative Data,https://doi.org/10.4135/9781506374680,Marilyn L. Mitchell; Greg Guest; Emily E. Namey,9781506374680,,2013
,Collection of Test Problems for Constrained Global Optimization Algorithms,Springer,Computer Science,http://dx.doi.org/10.1007/3-540-53032-0,"Christodoulos A. Floudas, Panos M. Pardalos",9783540463276,455,1990
,Collective Light Emission — Many quantum emitters,Institute of Physics Publishing ,"Physcis , Optics and photonics",https://iopscience.iop.org/book/978-0-7503-2699-5,"Jen (Richard), H",9780750326971,,2020
,Collocation Methods for Parabolic Equations in a Single Space Variable,Springer,Mathematics,http://dx.doi.org/10.1007/BFb0057337,"Jim Douglas, Todd Dupont",9783540383376,385,1974
,"Colloids and Colloid Assemblies - Synthesis, Modification, Organization and Utilization of  Colloid Particles",Wiley,"Chemistry, Physical Chemistry",https://onlinelibrary.wiley.com/doi/book/10.1002/3527602100,Caruso,9783527602100,,2004
,Colloids and Interfaces with Surfactants and Polymers - An Introduction,Wiley,"Chemistry, Physical Chemistry",https://onlinelibrary.wiley.com/doi/book/10.1002/0470093919,Goodwin,9780470093917,,2004
,Colloquium on Methods of Optimization,Springer,Mathematics,http://dx.doi.org/10.1007/BFb0060193,N. N. Moiseev,9783540362043,112,1970
,COLOG-88,Springer,Computer Science,http://dx.doi.org/10.1007/3-540-52335-9,"Per Martin-Löf, Grigori Mints",9783540469636,417,1990
,Color - Communication in Architectural Space,Birkhäuser,Design,http://www.degruyter.com/isbn/9783764382865,"Meerwein, Gerhard / Rodeck, Bettina / Mahnke, Frank H.",9783764382865,,2007
,Color Theory,Bloomsbury Design Library 2021 Collection,Colors--History,https://doi.org/10.5040/9781350027299?locatt=label:secondary_bloomsburyVisualArts,Aaron Fine,9781350027299,,2021
,Colour Is Communication,Birkhäuser,Design,http://www.degruyter.com/isbn/9783764382025,"Arnoldi, Per",9783764382025,,2007
,Combating Bad Weather Part I,Synthesis Collection of Technology (R0),"Computing and Processing, Geoscience, Communication, Networking and Broadcast Technologies",https://doi.org/10.1007/978-3-031-02251-7,"Sudipta Mukhopadhyay, Abhishek Kumar Tripathi",9783031022517,,2015
,Combating Bad Weather Part II,Synthesis Collection of Technology (R0),"Geoscience, General Topics for Engineers, Computing and Processing",https://doi.org/10.1007/978-3-031-02252-4,"Sudipta Mukhopadhyay, Abhishek Kumar Tripathi",9783031022524,,2015
,Combating Security Challenges in the Age of Big Data,Springer,Computer Science,http://link.springer.com/openurl?genre=book&isbn=978-3-030-35642-2,"Zubair Md. Fadlullah, Al-Sakib Khan Pathan",9783030356422,,2020
,Combinatoire énumérative,Springer,Mathematics,http://dx.doi.org/10.1007/BFb0072503,"Gilbert Labelle, Pierre Leroux",9783540474029,1234,1986
,Combinatoire et Représentation du Groupe Symétrique,Springer,Mathematics,http://dx.doi.org/10.1007/BFb0090008,Dominique Foata,9783540373858,579,1977
,Combinatorial Algorithms,Springer,Computer Science,http://link.springer.com/openurl?genre=book&isbn=978-3-030-48966-3,"Leszek Gąsieniec, Ralf Klasing, Tomasz Radzik",9783030489663,,2020
,Combinatorial Image Analysis,Springer,Computer Science,http://link.springer.com/openurl?genre=book&isbn=978-3-030-51002-2,"Tibor Lukić, Reneta P. Barneva, Valentin E. Brimkov, Lidija Čomić, Nataša Sladoje",9783030510022,,2020
,Combinatorial Mathematics III,Springer,Mathematics,http://dx.doi.org/10.1007/BFb0069539,"Anne Penfold Street, Walter Denis Wallis",9783540374824,452,1975
,Combinatorial Mathematics IV,Springer,Mathematics,http://dx.doi.org/10.1007/BFb0097362,"Louis R. A. Casse, Walter D. Wallis",9783540375371,560,1976
,Combinatorial Mathematics IX,Springer,Mathematics,http://dx.doi.org/10.1007/BFb0061970,"Elizabeth J. Billington, Sheila Oates-Williams, Anne Penfold Street",9783540393757,952,1982
,Combinatorial Mathematics V,Springer,Mathematics,http://dx.doi.org/10.1007/BFb0069176,Charles H. C. Little,9783540370208,622,1977
,Combinatorial Mathematics VI,Springer,Mathematics,http://dx.doi.org/10.1007/BFb0102678,"A. F. Horadam, W. D. Wallis",9783540348573,748,1979
,Combinatorial Mathematics VII,Springer,Mathematics,http://dx.doi.org/10.1007/BFb0088895,"Robert W. Robinson, George W. Southern, Walter D. Wallis",9783540383765,829,1980
,Combinatorial Mathematics VIII,Springer,Mathematics,http://dx.doi.org/10.1007/BFb0091801,Kevin L. McAvaney,9783540387923,884,1981
,Combinatorial Mathematics X,Springer,Mathematics,http://dx.doi.org/10.1007/BFb0071504,Louis Reynolds Antoine Casse,9783540386940,1036,1983
,Combinatorial Mathematics: Proceedings of the International Conference on Combinatorial Theory Canberra,Springer,Mathematics,http://dx.doi.org/10.1007/BFb0062510,"D. A. Holton, Jennifer Seberry",9783540357025,686,1978
,Combinatorial Mathematics: Proceedings of the Second Australian Conference,Springer,Mathematics,http://dx.doi.org/10.1007/BFb0057369,Derek A. Holton,9783540378372,403,1974
,Combinatorial Number Theory,De Gruyter,"Discrete Mathematics , Discrete Mathematics",http://www.degruyter.com/isbn/9783110280616,"Landman, Bruce / Nathanson, Melvyn B. / Nešetril, Jaroslav / Pomerance, Carl / Nowakowski, Richard J. / Robertson, Aaron",9783110280616,,2013
,Combinatorial Optimization,Springer,Computer Science,http://link.springer.com/openurl?genre=book&isbn=978-3-030-53262-8,"Mourad Baïou, Bernard Gendron, Oktay Günlük, A. Ridha Mahjoub",9783030532628,,2020
,Combinatorial Optimization,Springer,Mathematics,http://dx.doi.org/10.1007/BFb0083460,Bruno Simeone,9783030532628,1403,1989
,Combinatorial Optimization and Applications,Springer,Computer Science,http://link.springer.com/openurl?genre=book&isbn=978-3-030-64843-5,"Weili Wu, Zhongnan Zhang",9783030648435,,2020
,"Combinatorial Pattern Matching: 4th Annual Symposium, CPM 93 Padova",Springer,Computer Science,http://dx.doi.org/10.1007/BFb0029791,"Alberto Apostolico, Maxime Crochemore, Zvi Galil, Udi Manber",9783540477327,684,1993
,"Combinatorial Pattern Matching: 5th Annual Symposium, CPM 94 Asilomar",Springer,Computer Science,http://dx.doi.org/10.1007/3-540-58094-8,"Maxime Crochemore, Dan Gusfield",9783540484509,807,1994
,"Combinatorial Pattern Matching: 6th Annual Symposium, CPM 95 Espoo",Springer,Computer Science,http://dx.doi.org/10.1007/3-540-60044-2,"Zvi Galil, Esko Ukkonen",9783540494126,937,1995
,"Combinatorial Pattern Matching: 7th Annual Symposium, CPM 96 Laguna Beach",Springer,Computer Science,http://dx.doi.org/10.1007/3-540-61258-0,"Dan Hirschberg, Gene Myers",9783540683902,1075,1996
,"Combinatorial Pattern Matching: Third Annual Symposium Tucson, Arizona",Springer,Computer Science,http://dx.doi.org/10.1007/3-540-56024-6,"Alberto Apostolico, Maxime Crochemore, Zvi Galil, Udi Manber",9783540473572,644,1992
,Combinatorial Rigidity,American Mathematical Society,Mathematics,https://www.ams.org/books/gsm/002/,Jack Graver; Brigitte Servatius; Herman Servatius,9781470420659, ,1993
,Combinatorial Theory,Springer,Mathematics,http://dx.doi.org/10.1007/BFb0062982,"Dieter Jungnickel, Klaus Vedder",9783540393801,969,1982
,Combinatorial Theory Seminar Eindhoven University of Technology,Springer,Mathematics,http://dx.doi.org/10.1007/BFb0057319,Jacobus H. Lint,9783540383161,382,1974
,Combinatorics and Computer Science,Springer,Computer Science,http://dx.doi.org/10.1007/3-540-61576-8,"Michel Deza, Reinhardt Euler, Ioannis Manoussakis",9783540706274,1120,1996
,Combinatorics and Graph Theory,Springer,Mathematics,http://dx.doi.org/10.1007/BFb0092249,Siddani Bhaskara Rao,9783540470373,885,1981
,Combinatorics on Traces,Springer,Computer Science,http://dx.doi.org/10.1007/3-540-53031-2,Volker Diekert,9783540463184,454,1990
,"Combinatorics: Room Squares, Sum-Free Sets, Hadamard Matrices",Springer,Mathematics,http://dx.doi.org/10.1007/BFb0069907,"W. D. Wallis, Jennifer Seberry Wallis, Anne Penfold Street",9783540379942,292,1972
,"Combinators and Functional Programming Languages Thirteenth Spring School of the LITP Val d'Ajol, France, May 6–10, 1985 Proceedings",Springer,Computer Science,http://dx.doi.org/10.1007/3-540-17184-3,"Guy Cousineau, Pierre-Louis Curien, Bernard Robinet",9783540472537,242,1986
,Combined Finite-Discrete Element Method,Wiley,"Physical Sciences & Engineering, Mechanical Engineering",https://onlinelibrary.wiley.com/doi/book/10.1002/0470020180,Munjiza,9780470020180,,2004
,Combustion,Academic Press,Energy ,https://www.sciencedirect.com/science/book/9780124079137,"Glassman, Irvin",,5th ed.,2014
,Comets to Cosmology,Springer,Physics,http://dx.doi.org/10.1007/BFb0118781,Andrew Lawrence,9783540390671,297,1988
,Comics as Communication,Springer Nature,"Literature, Cultural and Media Studies",https://link.springer.com/openurl?genre=book&isbn=978-3-030-29722-0,Paul Fisher Davies,9783030297220,,2019
,Comics Memory,Springer Nature,"Literature, Cultural and Media Studies",https://link.springer.com/openurl?genre=book&isbn=978-3-319-91746-7,"Maaheen Ahmed, Benoît Crucifix",9783319917467,,2018
,Commercializing Successful Biomedical Technologies,Cambridge University Press,"Engineering,Life Sciences, Biomedical Engineering,Biotechnology",https://doi.org/10.1017/CBO9780511791345,Mehta,9780511791345,,2012
,Common Ground in Electronically Mediated Conversation,Synthesis Collection of Technology (R0),Computing and Processing,https://doi.org/10.1007/978-3-031-02184-8,Andrew Monk,9783031021848,,2009
,Communicating Social Science Research to Policy Makers,SAGE Publications Ltd,"Social sciences, Research",https://doi.org/10.4135/9781412983686,Roger J. Vaughan; Terry F. Buss,9781412983686,,1998
,Communication and Agreement Abstractions for Fault-Tolerant Asynchronous Distributed Systems,Synthesis Collection of Technology (R0),Computing and Processing,https://doi.org/10.1007/978-3-031-02000-1,Michel Raynal,9783031020001,,2010
,Communication and Cooperation in Agent Systems,Springer,Computer Science,http://dx.doi.org/10.1007/3-540-61044-8,Afsaneh Haddadi,9783540498766,1056,1996
,Communication Networks : A Concise Introduction,Synthesis Collection of Technology (R0),"Communication, Networking and Broadcast Technologies",https://doi.org/10.1007/978-3-031-79986-0,"Jean Walrand, Shyam Parekh",9783031799860,,2010
,Communication Networks : A Concise Introduction,Synthesis Collection of Technology (R0),"Communication, Networking and Broadcast Technologies",https://doi.org/10.1007/978-3-031-79281-6,"Jean Walrand, Shyam Parekh",9783031792816,2nd ed.,2018
,Communication Protocols,Springer,Computer Science,http://link.springer.com/openurl?genre=book&isbn=978-3-030-50405-2,Drago Hercog,9783030504052,,2020
,Communication Research Statistics,SAGE Publications Ltd,Research Statistics,https://doi.org/10.4135/9781412983693,John C. Reinard,9781412983693,,2006
,Communication Skills for Engineers and Scientists,PHI,Humanaties,https://elibrary.phindia.com/ebooks/reader/9789354437229,"Sharma, Sangeeta , Mishra, Binod",9789354437229,,2016
,Communication Systems,Wiley India,Engineering,https://ebooks.wileyindia.com/product-details/368485,Haykin,9789354640957,5th ed.,2022
,Communication Technologies for Vehicles,Springer,Computer Science,http://link.springer.com/openurl?genre=book&isbn=978-3-030-66030-7,"Francine Krief, Hasnaâ Aniss, Léo Mendiboure, Serge Chaumette, Marion Berbineau",9783030660307,,2020
,Communication Theory and Research,SAGE Publications Ltd,Communication,https://doi.org/10.4135/9780857024374,Peter Golding; Els De Bens; Denis McQuail,9780857024374,,2006
,Communications and Networking,Springer,Computer Science,http://link.springer.com/openurl?genre=book&isbn=978-3-030-41114-5,"Honghao Gao, Zhiyong Feng, Jun Yu, Jun Wu",9783030411145,,2020
,Communications and Networking,Springer,Computer Science,http://link.springer.com/openurl?genre=book&isbn=978-3-030-41117-6,"Honghao Gao, Zhiyong Feng, Jun Yu, Jun Wu",9783030411176,,2020
,Communities of Computing: Computer Science and Society in the ACM,Association for Computing Machinery,History of Computing,https://dl.acm.org/citation.cfm?id=2973856,Thomas J. Misa,9781970001860,,2016
,Community detection and mining in social media,Synthesis Collection of Technology (R0),Computing and Processing,https://doi.org/10.1007/978-3-031-01900-5,"Lei Tang, Huan Liu",9783031019005,,2010
,Community Energy Networks With Storage,Springer Nature,Energy,https://link.springer.com/openurl?genre=book&isbn=978-981-287-652-2,"Kaveh Rajab Khalilpour, Anthony Vassallo",9789812876522,,2016
,Community Search over Big Graphs,Synthesis Collection of Technology (R0),"Communication, Networking and Broadcast Technologies, Components, Circuits, Devices and Systems, Computing and Processing, General Topics for Engineers",https://doi.org/10.1007/978-3-031-01874-9,"Xin Huang, Laks V.S. Lakshmanan, Jianliang Xu",9783031018749,,2019
,Community-Based Participatory Research,SAGE Publications Ltd,Participatory Research,https://doi.org/10.4135/9781452244181,Karen Hacker,9781452244181,,2013
,Community-Based Qualitative Research,SAGE Publications Ltd,Qualitative Research,https://doi.org/10.4135/9781071802809,Holton,9781071802809,,2017
,Commutative Algebra,Springer,Mathematics,http://dx.doi.org/10.1007/BFb0085532,"Winfried Bruns, Aron Simis",9783540471363,1430,1990
,Commutative Coherent Rings,Springer,Mathematics,http://dx.doi.org/10.1007/BFb0084570,Sarah Glaz,9783540461593,1371,1989
,Commutative Formal Groups,Springer,Mathematics,http://dx.doi.org/10.1007/BFb0070554,Michel Lazard,9783540374312,443,1975
,Commutative group schemes,Springer,Mathematics,http://dx.doi.org/10.1007/BFb0097479,F. Oort,9783540371717,15,1966
,Commutative Rings whose Finitely Generated Modules Decompose,Springer,Mathematics,http://dx.doi.org/10.1007/BFb0069021,Willy Brandal,9783540351818,723,1979
,Commuting Nonselfadjoint Operators in Hilbert Space,Springer,Mathematics,http://dx.doi.org/10.1007/BFb0078925,"Moshe S. Livšic, Leonid L. Waksman",9783540478775,1272,1987
,Compact Right Topological Semigroups and Generalizations of Almost Periodicity,Springer,Mathematics,http://dx.doi.org/10.1007/BFb0061381,"John F. Berglund, Hugo D. Junghenn, Paul Milnes",9783540357599,663,1978
,Compact Semitopological Semigroups and Weakly Almost Periodic Functions,Springer,Mathematics,http://dx.doi.org/10.1007/BFb0073920,"J. F. Berglund, K. H. Hofmann",9783540351849,42,1967
,Compact Semitopological Semigroups: An Intrinsic Theory,Springer,Mathematics,http://dx.doi.org/10.1007/BFb0073675,Wolfgang Ruppert,9783540389385,1079,1984
,Compact Systems of Sets,Springer,Mathematics,http://dx.doi.org/10.1007/BFb0078990,"J. Pfanzagl, W. Pierlo",9783540371724,16,1966
,Compactification des Espaces Harmoniques,Springer,Mathematics,http://dx.doi.org/10.1007/BFb0060998,Constantin Meghea,9783540369028,222,1971
